{
  "$schema": "https://json-schema.org/draft/2020-12/schema",
  "$id": "https://oocc.dev/schemas/trace.schema.json",
  "title": "Trace",
  "description": "OOCC execution trace envelope. PRD docs/PRD.md §3.1-3.3. This file is append-only: existing fields, enum members, and $defs must not be removed or repurposed after release. Add new optional fields or new enum members only, and bump schema_version's minor component in the same PR.",
  "type": "object",
  "additionalProperties": false,
  "required": ["schema_version", "run_id", "language", "source_hash", "status", "meta", "steps"],
  "properties": {
    "schema_version": {
      "type": "string",
      "description": "Contract version, e.g. \"1.0\". Bump the minor component for additive changes.",
      "pattern": "^[0-9]+\\.[0-9]+$",
      "examples": ["1.0", "1.1"]
    },
    "run_id": {
      "type": "string",
      "description": "Opaque run identifier.",
      "pattern": "^r_[A-Za-z0-9]+$"
    },
    "language": {
      "type": "string",
      "description": "Source language the trace was produced from. §3.5 requires C++ to reuse this same contract.",
      "enum": ["python", "cpp"]
    },
    "source_hash": {
      "type": "string",
      "description": "sha256 of the exact source text that was executed. Used as the cache key (§4.4) and for wasm artifact caching (§3.5).",
      "pattern": "^sha256:[a-f0-9]{64}$"
    },
    "status": {
      "$ref": "#/$defs/Status"
    },
    "meta": {
      "$ref": "#/$defs/Meta"
    },
    "error": {
      "$ref": "#/$defs/ExecutionError"
    },
    "steps": {
      "type": "array",
      "description": "The full step-by-step trace. May be a truncated prefix/suffix per §3.3 when meta.truncated is true.",
      "items": { "$ref": "#/$defs/Step" }
    }
  },
  "allOf": [
    {
      "description": "status in {runtime_error, compile_error} must carry a populated error object. A truncated or failed run is still a valid, playable trace, never an exception.",
      "if": {
        "properties": { "status": { "enum": ["runtime_error", "compile_error"] } },
        "required": ["status"]
      },
      "then": { "required": ["error"] }
    }
  ],

  "$defs": {
    "Status": {
      "type": "string",
      "enum": ["ok", "runtime_error", "timeout", "step_limit", "memory_limit", "compile_error"]
    },

    "Meta": {
      "type": "object",
      "additionalProperties": false,
      "required": ["duration_ms", "step_count", "truncated", "stdin", "peak_heap_objects"],
      "properties": {
        "duration_ms": { "type": "number", "minimum": 0 },
        "step_count": {
          "type": "integer",
          "minimum": 0,
          "description": "Number of steps actually recorded in `steps` (may be less than the executed step count when truncated)."
        },
        "truncated": {
          "type": "boolean",
          "description": "True when `steps` does not contain every executed step. §3.3: on step_limit breach, keep first 40k + last 10k."
        },
        "stdin": { "type": "string" },
        "peak_heap_objects": { "type": "integer", "minimum": 0 }
      }
    },

    "ExecutionError": {
      "type": "object",
      "description": "Populated when status is runtime_error or compile_error.",
      "additionalProperties": false,
      "required": ["type", "message"],
      "properties": {
        "type": { "type": "string", "description": "Exception class name, e.g. \"ZeroDivisionError\"." },
        "message": { "type": "string" },
        "line": { "type": "integer", "minimum": 1 },
        "step": {
          "type": "integer",
          "minimum": 0,
          "description": "Index into `steps` (or the pre-truncation step count) where the error occurred."
        },
        "traceback": {
          "type": "array",
          "items": { "type": "string" }
        }
      }
    },

    "Value": {
      "description": "The {val:...}/{ref:\"oN\"} encoding (§3.2). Primitives inline as {val}; anything else is a heap reference. Bare JSON null is accepted as shorthand wherever a Value is expected (e.g. a None-valued object field) and is equivalent to {\"val\": null, \"repr\": \"None\"} — reconciles the worked TreeNode example in §3.2, where `\"right\": null` appears unwrapped, with the value-encoding paragraph's stated rule that null is {\"val\": null}.",
      "oneOf": [
        { "type": "null" },
        { "$ref": "#/$defs/ValueInline" },
        { "$ref": "#/$defs/ValueRef" }
      ]
    },

    "ValueInline": {
      "type": "object",
      "description": "A primitive inlined directly in the trace, e.g. {\"val\": 4}.",
      "additionalProperties": false,
      "required": ["val"],
      "properties": {
        "val": true,
        "repr": { "type": "string", "description": "Optional display form, e.g. \"None\" for a Python None val." }
      }
    },

    "ValueRef": {
      "type": "object",
      "description": "A reference into `heap`, e.g. {\"ref\": \"o1\"}.",
      "additionalProperties": false,
      "required": ["ref"],
      "properties": {
        "ref": { "$ref": "#/$defs/HeapRef" }
      }
    },

    "HeapRef": {
      "type": "string",
      "pattern": "^o[0-9]+$"
    },

    "FrameId": {
      "type": "string",
      "pattern": "^f[0-9]+$"
    },

    "Identifier": {
      "type": "string",
      "pattern": "^[A-Za-z_][A-Za-z0-9_]*$"
    },

    "Frame": {
      "type": "object",
      "description": "One entry in Step.stack. Index 0 of the enclosing array is the outermost frame.",
      "additionalProperties": false,
      "required": ["frame_id", "func", "line", "locals"],
      "properties": {
        "frame_id": { "$ref": "#/$defs/FrameId" },
        "func": { "type": "string" },
        "line": { "type": "integer", "minimum": 1 },
        "locals": {
          "type": "object",
          "description": "Local variable bindings for this frame at this step.",
          "propertyNames": { "$ref": "#/$defs/Identifier" },
          "additionalProperties": { "$ref": "#/$defs/Value" }
        },
        "args": {
          "type": "array",
          "description": "Parameter names in call order, present on frames pushed by a call.",
          "items": { "type": "string" }
        },
        "call_site_line": {
          "type": "integer",
          "minimum": 1,
          "description": "Line in the caller's frame that made this call."
        }
      }
    },

    "ChangedPath": {
      "type": "string",
      "description": "The `changed` path grammar (§3.2): frame_id.local | oN[index] | oN.field | oN{key}.",
      "pattern": "^(f[0-9]+\\.[A-Za-z_][A-Za-z0-9_]*|o[0-9]+\\[[0-9]+\\]|o[0-9]+\\.[A-Za-z_][A-Za-z0-9_]*|o[0-9]+\\{[^{}]*\\})$"
    },

    "Step": {
      "type": "object",
      "additionalProperties": false,
      "required": ["i", "event", "line", "func", "depth", "stack", "stdout_delta", "changed"],
      "properties": {
        "i": { "type": "integer", "minimum": 0, "description": "0-based, monotonic step index." },
        "event": { "$ref": "#/$defs/StepEvent" },
        "line": { "type": "integer", "minimum": 1, "description": "1-based line in source." },
        "func": { "type": "string", "description": "Name of the function owning this step (top of stack)." },
        "depth": { "type": "integer", "minimum": 0, "description": "Call stack depth." },
        "stack": {
          "type": "array",
          "minItems": 1,
          "items": { "$ref": "#/$defs/Frame" }
        },
        "heap": {
          "type": "object",
          "description": "Full snapshot of reachable non-primitives at this step, keyed by heap id. §3.4 (Phase 6): present on keyframe steps only (every 50th step by position, plus step 0). Non-keyframe steps carry `heap_patch` instead — never both, never neither. A trace produced before Phase 6's wire optimization shipped has `heap` on every step and no `heap_patch` at all, which is still a fully valid trace (every step is trivially its own keyframe); consumers must not assume every trace uses the interval scheme.",
          "propertyNames": { "$ref": "#/$defs/HeapRef" },
          "additionalProperties": { "$ref": "#/$defs/HeapObject" }
        },
        "heap_patch": {
          "type": "array",
          "description": "§3.4 (Phase 6): an RFC 6902 JSON Patch, `add`/`remove`/`replace` only, from the previous step's *reconstructed* heap to this step's heap. Present on non-keyframe steps instead of `heap`. Paths are JSON Pointers into the heap object, e.g. \"/o1/items/4/val\". Reconstruct by walking back to the nearest preceding step with `heap` set and applying every intervening step's `heap_patch` in order — see apps/web/lib/player/getStateAt.ts, the one seam every component reads trace state through.",
          "items": { "$ref": "#/$defs/JsonPatchOp" }
        },
        "stdout_delta": { "type": "string" },
        "changed": {
          "type": "array",
          "description": "Paths mutated since the previous step. Drives every highlight animation — must be exact.",
          "items": { "$ref": "#/$defs/ChangedPath" }
        },
        "returned": { "$ref": "#/$defs/Value" },
        "heap_truncated": {
          "type": "boolean",
          "description": "True when this step exceeded the 5,000 heap-objects-per-step cap (§3.3) and deep-snapshotting was stopped."
        }
      },
      "allOf": [
        {
          "description": "`returned` is present if and only if event == \"return\".",
          "if": {
            "properties": { "event": { "const": "return" } },
            "required": ["event"]
          },
          "then": { "required": ["returned"] },
          "else": { "not": { "required": ["returned"] } }
        },
        {
          "description": "`heap` and `heap_patch` are mutually exclusive.",
          "not": { "required": ["heap", "heap_patch"] }
        }
      ]
    },

    "JsonPatchOp": {
      "type": "object",
      "description": "One RFC 6902 operation. Phase 6's diff only ever emits add/remove/replace (never move/copy/test), so those are the only ops modeled here — a hand-written JSON Patch elsewhere in the trace is not a supported input.",
      "additionalProperties": false,
      "required": ["op", "path"],
      "properties": {
        "op": { "type": "string", "enum": ["add", "remove", "replace"] },
        "path": { "type": "string", "description": "A JSON Pointer (RFC 6901)." },
        "value": {}
      },
      "allOf": [
        {
          "if": { "properties": { "op": { "const": "remove" } }, "required": ["op"] },
          "then": { "not": { "required": ["value"] } },
          "else": { "required": ["value"] }
        }
      ]
    },

    "StepEvent": {
      "type": "string",
      "enum": ["line", "call", "return", "exception", "stdout"]
    },

    "HeapObject": {
      "description": "A heap-resident value. §3.2 lists list, tuple, dict, set, str (>40 chars), object/instance (fields), function, and the opaque fallback. An object/instance uses its class name as the `type` discriminator (see the worked TreeNode example in §3.2), so `type` is unconstrained beyond excluding the reserved primitive discriminators handled by the other branches.",
      "oneOf": [
        { "$ref": "#/$defs/HeapList" },
        { "$ref": "#/$defs/HeapTuple" },
        { "$ref": "#/$defs/HeapDict" },
        { "$ref": "#/$defs/HeapSet" },
        { "$ref": "#/$defs/HeapStr" },
        { "$ref": "#/$defs/HeapFunction" },
        { "$ref": "#/$defs/HeapOpaque" },
        { "$ref": "#/$defs/HeapInstance" }
      ]
    },

    "HeapList": {
      "type": "object",
      "additionalProperties": false,
      "required": ["type", "len", "items"],
      "properties": {
        "type": { "const": "list" },
        "len": { "type": "integer", "minimum": 0 },
        "items": { "type": "array", "items": { "$ref": "#/$defs/Value" } }
      }
    },
    "HeapTuple": {
      "type": "object",
      "additionalProperties": false,
      "required": ["type", "len", "items"],
      "properties": {
        "type": { "const": "tuple" },
        "len": { "type": "integer", "minimum": 0 },
        "items": { "type": "array", "items": { "$ref": "#/$defs/Value" } }
      }
    },
    "HeapDict": {
      "type": "object",
      "additionalProperties": false,
      "required": ["type", "len", "entries"],
      "properties": {
        "type": { "const": "dict" },
        "len": { "type": "integer", "minimum": 0 },
        "entries": {
          "type": "array",
          "description": "Insertion-ordered key/value pairs. A list (not a JSON object) because Python dict keys need not be strings.",
          "items": {
            "type": "object",
            "additionalProperties": false,
            "required": ["key", "value"],
            "properties": {
              "key": { "$ref": "#/$defs/Value" },
              "value": { "$ref": "#/$defs/Value" }
            }
          }
        }
      }
    },
    "HeapSet": {
      "type": "object",
      "additionalProperties": false,
      "required": ["type", "len", "items"],
      "properties": {
        "type": { "const": "set" },
        "len": { "type": "integer", "minimum": 0 },
        "items": { "type": "array", "items": { "$ref": "#/$defs/Value" } }
      }
    },
    "HeapStr": {
      "type": "object",
      "description": "Strings longer than 40 chars move to the heap; shorter strings stay inlined as {val: \"...\"}.",
      "additionalProperties": false,
      "required": ["type", "len", "value"],
      "properties": {
        "type": { "const": "str" },
        "len": { "type": "integer", "minimum": 0 },
        "value": { "type": "string" }
      }
    },
    "HeapFunction": {
      "type": "object",
      "additionalProperties": false,
      "required": ["type", "name"],
      "properties": {
        "type": { "const": "function" },
        "name": { "type": "string" },
        "qualname": { "type": "string" }
      }
    },
    "HeapOpaque": {
      "type": "object",
      "description": "Fallback for any value the tracer can't project into a richer type.",
      "additionalProperties": false,
      "required": ["type", "repr"],
      "properties": {
        "type": { "const": "opaque" },
        "repr": { "type": "string" }
      }
    },
    "HeapInstance": {
      "type": "object",
      "description": "object (with fields) / instance of a user class. `type` is the class name, e.g. \"TreeNode\".",
      "additionalProperties": false,
      "required": ["type", "fields"],
      "properties": {
        "type": {
          "type": "string",
          "not": { "enum": ["list", "tuple", "dict", "set", "str", "function", "opaque"] }
        },
        "fields": {
          "type": "object",
          "propertyNames": { "$ref": "#/$defs/Identifier" },
          "additionalProperties": { "$ref": "#/$defs/Value" }
        }
      }
    }
  }
}
