{
  "schema_version": "1.0",
  "run_id": "r_cppfix911833607532",
  "language": "cpp",
  "source_hash": "sha256:96ae8ba477653dae35e94a8a9e2d3cd240bf142e57298683364fe2f28e61ab58",
  "status": "runtime_error",
  "meta": {
    "duration_ms": 0,
    "step_count": 8,
    "truncated": false,
    "stdin": "",
    "peak_heap_objects": 1
  },
  "error": {
    "type": "wasm_trap",
    "message": "memory access out of bounds",
    "step": 7
  },
  "steps": [
    {
      "i": 0,
      "event": "line",
      "line": 13,
      "func": "main",
      "depth": 1,
      "stack": [
        {
          "frame_id": "f1",
          "func": "main",
          "line": 13,
          "locals": {}
        }
      ],
      "heap": {},
      "stdout_delta": "",
      "changed": []
    },
    {
      "i": 1,
      "event": "line",
      "line": 14,
      "func": "main",
      "depth": 1,
      "stack": [
        {
          "frame_id": "f1",
          "func": "main",
          "line": 14,
          "locals": {
            "buffer": {
              "ref": "o2"
            }
          }
        }
      ],
      "heap": {
        "o2": {
          "type": "list",
          "len": 0,
          "items": []
        }
      },
      "stdout_delta": "",
      "changed": [
        "f1.buffer"
      ]
    },
    {
      "i": 2,
      "event": "line",
      "line": 15,
      "func": "main",
      "depth": 1,
      "stack": [
        {
          "frame_id": "f1",
          "func": "main",
          "line": 15,
          "locals": {
            "buffer": {
              "ref": "o2"
            }
          }
        }
      ],
      "heap": {
        "o2": {
          "type": "list",
          "len": 1,
          "items": [
            {
              "val": 1
            }
          ]
        }
      },
      "stdout_delta": "",
      "changed": [
        "o2[0]"
      ]
    },
    {
      "i": 3,
      "event": "line",
      "line": 16,
      "func": "main",
      "depth": 1,
      "stack": [
        {
          "frame_id": "f1",
          "func": "main",
          "line": 16,
          "locals": {
            "buffer": {
              "ref": "o2"
            }
          }
        }
      ],
      "heap": {
        "o2": {
          "type": "list",
          "len": 2,
          "items": [
            {
              "val": 1
            },
            {
              "val": 2
            }
          ]
        }
      },
      "stdout_delta": "",
      "changed": [
        "o2[1]"
      ]
    },
    {
      "i": 4,
      "event": "line",
      "line": 18,
      "func": "main",
      "depth": 1,
      "stack": [
        {
          "frame_id": "f1",
          "func": "main",
          "line": 18,
          "locals": {
            "buffer": {
              "ref": "o2"
            }
          }
        }
      ],
      "heap": {
        "o2": {
          "type": "list",
          "len": 3,
          "items": [
            {
              "val": 1
            },
            {
              "val": 2
            },
            {
              "val": 3
            }
          ]
        }
      },
      "stdout_delta": "",
      "changed": [
        "o2[2]"
      ]
    },
    {
      "i": 5,
      "event": "stdout",
      "line": 18,
      "func": "main",
      "depth": 1,
      "stack": [
        {
          "frame_id": "f1",
          "func": "main",
          "line": 18,
          "locals": {
            "buffer": {
              "ref": "o2"
            }
          }
        }
      ],
      "heap": {
        "o2": {
          "type": "list",
          "len": 3,
          "items": [
            {
              "val": 1
            },
            {
              "val": 2
            },
            {
              "val": 3
            }
          ]
        }
      },
      "stdout_delta": "about to write far past the end of a 3-element vector\n",
      "changed": []
    },
    {
      "i": 6,
      "event": "line",
      "line": 20,
      "func": "main",
      "depth": 1,
      "stack": [
        {
          "frame_id": "f1",
          "func": "main",
          "line": 20,
          "locals": {
            "buffer": {
              "ref": "o2"
            }
          }
        }
      ],
      "heap": {
        "o2": {
          "type": "list",
          "len": 3,
          "items": [
            {
              "val": 1
            },
            {
              "val": 2
            },
            {
              "val": 3
            }
          ]
        }
      },
      "stdout_delta": "",
      "changed": []
    },
    {
      "i": 7,
      "event": "line",
      "line": 21,
      "func": "main",
      "depth": 1,
      "stack": [
        {
          "frame_id": "f1",
          "func": "main",
          "line": 21,
          "locals": {
            "buffer": {
              "ref": "o2"
            },
            "bad_index": {
              "val": 100000000
            }
          }
        }
      ],
      "heap": {
        "o2": {
          "type": "list",
          "len": 3,
          "items": [
            {
              "val": 1
            },
            {
              "val": 2
            },
            {
              "val": 3
            }
          ]
        }
      },
      "stdout_delta": "",
      "changed": [
        "f1.bad_index"
      ]
    }
  ]
}
